{
  "$schema": "http://json-schema.org/draft-07/schema#",
  "$id": "https://sfmc.dev/schemas/registry-module.schema.json",
  "title": "SFMC registry module",
  "type": "object",
  "additionalProperties": false,
  "required": [
    "id",
    "name",
    "description",
    "version",
    "npm",
    "sdk",
    "license",
    "official"
  ],
  "properties": {
    "id": {
      "type": "string",
      "pattern": "^[a-z][a-z0-9]*(?:-[a-z0-9]+)*$"
    },
    "name": {
      "type": "string",
      "minLength": 1,
      "pattern": "\\S"
    },
    "description": {
      "type": "string"
    },
    "version": {
      "type": "string",
      "pattern": "^(0|[1-9][0-9]*)\\.(0|[1-9][0-9]*)\\.(0|[1-9][0-9]*)(?:-(?:0|[1-9][0-9]*|[0-9]*[a-zA-Z-][0-9a-zA-Z-]*)(?:\\.(?:0|[1-9][0-9]*|[0-9]*[a-zA-Z-][0-9a-zA-Z-]*))*)?(?:\\+[0-9a-zA-Z-]+(?:\\.[0-9a-zA-Z-]+)*)?$"
    },
    "npm": {
      "type": "string",
      "maxLength": 214,
      "pattern": "^(?:@[a-z0-9][a-z0-9._-]*/)?[a-z0-9][a-z0-9._-]*$"
    },
    "sdk": {
      "type": "string",
      "minLength": 1,
      "pattern": "\\S",
      "format": "semver-range"
    },
    "license": {
      "type": "string",
      "minLength": 1,
      "pattern": "\\S"
    },
    "official": {
      "type": "boolean"
    },
    "repo": {
      "type": "string",
      "minLength": 1,
      "pattern": "\\S"
    },
    "category": {
      "enum": [
        "gameplay",
        "utility",
        "system",
        "economy",
        "social"
      ]
    },
    "tags": {
      "type": "array",
      "uniqueItems": true,
      "items": {
        "type": "string",
        "minLength": 1,
        "pattern": "\\S"
      }
    },
    "requires": {
      "type": "array",
      "uniqueItems": true,
      "items": {
        "type": "string",
        "pattern": "^[a-z][a-z0-9]*(?:-[a-z0-9]+)*$"
      }
    },
    "authors": {
      "type": "array",
      "minItems": 1,
      "uniqueItems": true,
      "items": {
        "type": "string",
        "minLength": 1,
        "pattern": "\\S"
      }
    }
  }
}
