{
  "id": "gamemode-area",
  "name": "区域游戏模式",
  "description": "区域游戏模式切换与背包隔离置换",
  "version": "0.2.1",
  "npm": "@sfmc-bds/module-gamemode-area",
  "sdk": ">=0.2.0",
  "license": "ISC",
  "official": true,
  "category": "gameplay",
  "requires": [
    "area",
    "inventory-switcher"
  ],
  "repo": "https://github.com/Tanya7z/sfmc-module-gamemode-area"
}
