{
  "id": "activity-log",
  "name": "行为日志",
  "description": "",
  "version": "0.3.0",
  "npm": "@sfmc-bds/module-activity-log",
  "sdk": ">=0.2.0",
  "license": "ISC",
  "official": true,
  "category": "system",
  "requires": [],
  "repo": "https://github.com/DogeLakeDev/sfmc-module-activity-log"
}
