{
  "id": "fly-area",
  "name": "区域飞行",
  "description": "",
  "version": "0.2.1",
  "npm": "@sfmc-bds/module-fly-area",
  "sdk": ">=0.2.0",
  "license": "ISC",
  "official": true,
  "category": "gameplay",
  "requires": [
    "area"
  ],
  "repo": "https://github.com/Tanya7z/sfmc-module-fly-area"
}
