{
  "id": "peace-area",
  "name": "和平区域",
  "description": "区域怪物生成拦截",
  "version": "1.0.0",
  "npm": "@sfmc-bds/module-peace-area",
  "sdk": ">=0.2.0",
  "license": "ISC",
  "official": true,
  "category": "gameplay",
  "requires": [
    "area"
  ],
  "repo": "https://github.com/DogeLakeDev/sfmc-module-peace-area"
}
