{
  "id": "chat-sounds",
  "name": "chat-sounds",
  "description": "",
  "version": "0.2.1",
  "npm": "@sfmc-bds/module-chat-sounds",
  "sdk": ">=0.2.0",
  "license": "ISC",
  "official": true,
  "category": "social",
  "requires": [
    "chat"
  ],
  "repo": "https://github.com/Tanya7z/sfmc-module-chat-sounds"
}
