{
  "id": "coop",
  "name": "合作社",
  "description": "",
  "version": "0.2.2",
  "npm": "@sfmc-bds/module-coop",
  "sdk": ">=0.2.0-beta.17",
  "license": "ISC",
  "official": true,
  "category": "social",
  "requires": [
    "economy",
    "activity-log"
  ],
  "repo": "https://github.com/Tanya7z/sfmc-module-coop"
}
