{
  "id": "qa",
  "name": "QA",
  "description": "",
  "version": "0.2.1",
  "npm": "@sfmc-bds/module-qa",
  "sdk": ">=0.2.0-beta.17",
  "license": "ISC",
  "official": true,
  "category": "gameplay",
  "requires": [
    "economy",
    "chat"
  ],
  "repo": "https://github.com/Tanya7z/sfmc-module-qa"
}
