{
  "id": "online-time",
  "name": "在线时长统计",
  "description": "进服打点与心跳增量结转在线统计",
  "version": "0.2.2",
  "npm": "@sfmc-bds/module-online-time",
  "sdk": ">=0.2.0-beta.17",
  "license": "ISC",
  "official": true,
  "category": "utility",
  "requires": [],
  "repo": "https://github.com/Tanya7z/sfmc-module-online-time"
}
